{
  "id": "wh_01h8x9k2m3n4p5q6r7s8t9u0x1",
  "url": "https://myapp.com/webhooks/savvycal",
  "secret": "whsec_abcdefghijklmnopqrstuvwxyz0123456789",
  "state": "active",
  "version": "2020-11-18",
  "events": [
    "event.created",
    "event.canceled",
    "event.rescheduled"
  ],
  "created_at": "2026-01-15T09:00:00Z"
}
